{"contract_version":"1.1.0","generated_at":"2026-10-07T07:42:35Z","history_path":"history/2026-10-07T0742Z","competitions":[{"id":"bundesliga","name":"Bundesliga","file":"bundesliga.json","status":"updated","snapshot_generated_at":"2026-10-07T07:42:35Z","data_through":"2026-09-20","provisional":false,"error":null},{"id":"la_liga","name":"La Liga","file":"la_liga.json","status":"updated","snapshot_generated_at":"2026-10-07T07:42:35Z","data_through":"2026-09-20","provisional":false,"error":null},{"id":"ligue_1","name":"Ligue 1","file":"ligue_1.json","status":"updated","snapshot_generated_at":"2026-10-07T07:42:35Z","data_through":"2026-09-20","provisional":false,"error":null},{"id":"premier_league","name":"Premier League","file":"premier_league.json","status":"updated","snapshot_generated_at":"2026-10-07T07:42:35Z","data_through":"2026-09-20","provisional":false,"error":null},{"id":"serie_a","name":"Serie A","file":"serie_a.json","status":"updated","snapshot_generated_at":"2026-10-07T07:42:35Z","data_through":"2026-09-20","provisional":false,"error":null}]}
